{
  "$schema": "https://json-schema.org/draft/2020-12/schema",
  "$id": "schema.simplified.json",
  "title": "Tensile Test (Simplified Input)",
  "description": "A user-friendly form to describe a uniaxial tensile test and its results. Fill in the specimen IRI, test conditions, and the measured mechanical properties. This input will be automatically converted to a standardised RDF representation (TTO/PMDCo OO-LD).",
  "type": "object",
  "required": ["test_name", "specimen_iri"],
  "additionalProperties": false,
  "properties": {
    "test_name": {
      "title": "Test Name",
      "description": "A human-readable name for this tensile test. Example: 'Tensile test 316L bar 1'.",
      "type": "string",
      "minLength": 1,
      "examples": ["Tensile test 316L bar 1", "RT tensile test AlSi10Mg-A"]
    },
    "test_id": {
      "title": "Test ID",
      "description": "Optional. Identifier (IRI slug) for this test in the RDF graph. Auto-derived from test_name if omitted.",
      "type": "string"
    },
    "description": {
      "title": "Description",
      "description": "Optional free-text description of this test.",
      "type": "string"
    },
    "specimen_iri": {
      "title": "Specimen IRI",
      "description": "The IRI of the specimen being tested. This must reference an existing node in the knowledge graph (e.g. one registered with the specimen/PMDCo schema).",
      "type": "string",
      "format": "uri",
      "examples": ["https://example.org/specimens/316L-tensile-bar-1"]
    },
    "test_standard": {
      "title": "Test Standard",
      "description": "The standard or norm followed (e.g. 'ISO 6892-1', 'ASTM E8').",
      "type": "string",
      "examples": ["ISO 6892-1", "ASTM E8", "DIN EN ISO 6892-1"]
    },
    "strain_rate": {
      "title": "Strain Rate",
      "description": "Crosshead displacement rate or strain rate during the test.",
      "type": "number",
      "exclusiveMinimum": 0,
      "examples": [0.00025, 0.002]
    },
    "strain_rate_unit": {
      "title": "Strain Rate Unit",
      "description": "Unit for the strain rate value.",
      "type": "string",
      "default": "1/s",
      "examples": ["1/s", "mm/s"]
    },
    "temperature": {
      "title": "Test Temperature",
      "description": "Temperature at which the test was conducted, in °C.",
      "type": "number",
      "examples": [23, -40, 200]
    },
    "results": {
      "title": "Measured Properties",
      "description": "Mechanical properties determined from the test. Add one entry per property.",
      "type": "array",
      "items": {
        "title": "Result Entry",
        "type": "object",
        "required": ["property", "value", "unit"],
        "additionalProperties": false,
        "properties": {
          "property": {
            "title": "Property",
            "description": "Which mechanical property was determined.",
            "type": "string",
            "enum": [
              "YieldStrength",
              "UpperYieldStrength",
              "LowerYieldStrength",
              "TensileStrength",
              "ProofStrength",
              "PercentageElongationAfterFracture",
              "PercentagePermanentElongation",
              "PercentageReductionOfArea"
            ],
            "options": {
              "enum_titles": [
                "Yield Strength (Rₑ)",
                "Upper Yield Strength (ReH)",
                "Lower Yield Strength (ReL)",
                "Tensile Strength (Rm)",
                "Proof Strength (Rp)",
                "Elongation After Fracture (A)",
                "Permanent Elongation (Ag)",
                "Reduction of Area (Z)"
              ]
            }
          },
          "value": {
            "title": "Value",
            "description": "Numeric value of the measured property.",
            "type": "number",
            "exclusiveMinimum": 0,
            "examples": [310, 620, 40]
          },
          "unit": {
            "title": "Unit",
            "description": "Unit of the value: 'MPa' or 'GPa' for stress properties, '%' for elongation and reduction of area.",
            "type": "string",
            "enum": ["MPa", "GPa", "%"],
            "default": "MPa"
          }
        }
      },
      "default": []
    }
  },
  "examples": [
    {
      "test_name": "Tensile test 316L bar 1",
      "specimen_iri": "https://example.org/specimens/316L-tensile-bar-1",
      "test_standard": "ISO 6892-1",
      "strain_rate": 0.00025,
      "strain_rate_unit": "1/s",
      "temperature": 23,
      "results": [
        { "property": "YieldStrength",                    "value": 310, "unit": "MPa" },
        { "property": "TensileStrength",                  "value": 620, "unit": "MPa" },
        { "property": "PercentageElongationAfterFracture","value": 40,  "unit": "%" },
        { "property": "PercentageReductionOfArea",        "value": 65,  "unit": "%" }
      ]
    }
  ]
}
